{"assertions":[{"name":"all_four_expanded_environment_gates_pass","observed":["airway-edger-ql-same-engine-v1","airway-limma-gene-set-same-engine-v1","compcoder-edger-ql-nb-fdr-tpr-v1","compcoder-limma-self-contained-fdr-tpr-v1"],"passed":true,"requirement":"all four frozen P0/C1/C2 benchmarks rerun and pass"},{"name":"numeric_artifact_sha256_and_size_identity","observed":98,"passed":true,"requirement":"every archived numeric artifact name, SHA-256 digest, and byte size is identical in the expanded-environment rerun"},{"name":"rscript_relocation_is_conda_lock_bound","observed":"d56eb9cb63c0c727c0b3bd025d6c5559cf1362273a6b913bf4498a0bd5e5636c","passed":true,"requirement":"all four reports use the same live Rscript digest, and only that runtime field changes under the unchanged conda-lock.yml"},{"name":"installed_description_drift_is_source_archive_bound","observed":2,"passed":true,"requirement":"the only rebuilt installed-package DESCRIPTION records are disclosed and bind to unchanged versioned source archives"},{"name":"non_environment_evidence_is_byte_identical","observed":4,"passed":true,"requirement":"each rerun report equals its archive after restoring only the approved environment and installed DESCRIPTION build-metadata records"},{"name":"environment_transition_is_snapshot_bound","observed":["r-sources.lock","renv.lock","verify.R"],"passed":true,"requirement":"old hashes resolve through the immutable baseline snapshot and new hashes match the current locked environment"}],"baseline_snapshot":{"manifest":{"name":"environment/snapshots/p0-c1-c2-c6b6cd9/manifest.json","sha256":"6630cee71660c44a0264a47c81fb2dcce7dbc5d3152536d148b7594a1b64488f","size_bytes":854},"snapshot_id":"p0-c1-c2-c6b6cd9","source_revision":"c6b6cd970c1a0c6807145dd01033505efae60215"},"benchmarks":[{"archived_report":{"name":"tests/oracle/airway-benchmark-report.json","sha256":"446955638d367dc85b3b6440ddce7b5299717417aae2e0394991681f5df4c23f","size_bytes":6734},"artifact_inventory":{"count":5,"sha256":"5471c80432745a1e2b62707c4f4fa14b53bec4d2f7569984affb1a94cb3c63b5"},"benchmark_id":"airway-edger-ql-same-engine-v1","expanded_environment_report":{"name":"expanded-environment/airway-benchmark-report.json","sha256":"2067602c895c83e699c355c3b1f14b070b074ae4f919177a41034021780afcaa","size_bytes":6734},"implementation_changes":[{"after":{"name":"renv.lock","sha256":"f48ff0088369e717255509f66691b346d9f6ce827a77adfa1c815226c6cbcf5a","size_bytes":302438},"before":{"name":"renv.lock","sha256":"8d8ca4c7b9ab411150f207846d098cad799dcefe7219696a06e3ebf17cbe19ff","size_bytes":268638},"name":"renv.lock"},{"after":{"name":"r-sources.lock","sha256":"cbe8cdc6dae73a629dadf6a6c2e743f0fb95c20c9b85bb9acecbe23c64bd8659","size_bytes":1676},"before":{"name":"r-sources.lock","sha256":"0632d66bd4aee5cc00e7ee33f6061df0db3803843bd5bc98a91fb83c82e30f4d","size_bytes":1312},"name":"r-sources.lock"},{"after":{"name":"verify.R","sha256":"e9a1c9586e49b188311f1e8434bc412e6490c99c5b9b71be7624c1ba7722ed28","size_bytes":8540},"before":{"name":"verify.R","sha256":"0f13c98256143ae1febcb3750cd96b1c9d897d8a5cdfee1481018e12b1fc3a7e","size_bytes":8494},"name":"verify.R"}],"rebuild_metadata_changes":[],"runtime_metadata_changes":[{"after":"d56eb9cb63c0c727c0b3bd025d6c5559cf1362273a6b913bf4498a0bd5e5636c","before":"a09d33dc7b786eb86191e428b3f75406d3a25c5b8fdf8c8e4282d0e55451c331","conda_lock":{"name":"conda-lock.yml","sha256":"7cddb25b11bdd7d31a5dee156cfd2f8c456398005f3b2acc6c23d5df99e5b702","size_bytes":54784},"field":"rscript_sha256","reason":"locked_conda_prefix_relocation"}]},{"archived_report":{"name":"tests/oracle/pathway-airway-benchmark-report.json","sha256":"c14c1db1c94f53abee7c5d116b9b627d75041f5a8eb4edf7caafa5e9a059ca62","size_bytes":8236},"artifact_inventory":{"count":3,"sha256":"7b006a5d71e68baff204aee6856cf2721f331deee88cca69b27c119340d626bf"},"benchmark_id":"airway-limma-gene-set-same-engine-v1","expanded_environment_report":{"name":"expanded-environment/pathway-airway-benchmark-report.json","sha256":"ef746a2f285b2a11b1d5fbe4356c1bc112a2cdaadb03aa307e50fd201c4513e8","size_bytes":8236},"implementation_changes":[{"after":{"name":"renv.lock","sha256":"f48ff0088369e717255509f66691b346d9f6ce827a77adfa1c815226c6cbcf5a","size_bytes":302438},"before":{"name":"renv.lock","sha256":"8d8ca4c7b9ab411150f207846d098cad799dcefe7219696a06e3ebf17cbe19ff","size_bytes":268638},"name":"renv.lock"},{"after":{"name":"r-sources.lock","sha256":"cbe8cdc6dae73a629dadf6a6c2e743f0fb95c20c9b85bb9acecbe23c64bd8659","size_bytes":1676},"before":{"name":"r-sources.lock","sha256":"0632d66bd4aee5cc00e7ee33f6061df0db3803843bd5bc98a91fb83c82e30f4d","size_bytes":1312},"name":"r-sources.lock"},{"after":{"name":"verify.R","sha256":"e9a1c9586e49b188311f1e8434bc412e6490c99c5b9b71be7624c1ba7722ed28","size_bytes":8540},"before":{"name":"verify.R","sha256":"0f13c98256143ae1febcb3750cd96b1c9d897d8a5cdfee1481018e12b1fc3a7e","size_bytes":8494},"name":"verify.R"}],"rebuild_metadata_changes":[{"after":{"name":"airway/DESCRIPTION","sha256":"a737d5ca6cf2bdca07383c7730134c14ab90e17f7b1b34fde31fe3bb2acd864b","size_bytes":1508},"before":{"name":"airway/DESCRIPTION","sha256":"cabcacf8d885f119560c3551dde820ea75e184f79975b59a083b754907d9f57b","size_bytes":1508},"input_name":"airway/DESCRIPTION","reason":"installed_DESCRIPTION_build_metadata","source_archive":{"package":"airway","repository":"Bioconductor 3.23","role":"primary","sha256":"829f654fc8075ac9d810574e8a8d4672e69e847c45fa2ce598d1ffbc30c7fe19","url":"https://bioconductor.org/packages/3.23/data/experiment/src/contrib/airway_1.32.0.tar.gz","version":"1.32.0"}}],"runtime_metadata_changes":[{"after":"d56eb9cb63c0c727c0b3bd025d6c5559cf1362273a6b913bf4498a0bd5e5636c","before":"a09d33dc7b786eb86191e428b3f75406d3a25c5b8fdf8c8e4282d0e55451c331","conda_lock":{"name":"conda-lock.yml","sha256":"7cddb25b11bdd7d31a5dee156cfd2f8c456398005f3b2acc6c23d5df99e5b702","size_bytes":54784},"field":"rscript_sha256","reason":"locked_conda_prefix_relocation"}]},{"archived_report":{"name":"tests/simulation/compcoder-benchmark-report.json","sha256":"a95f50ecbc96a48847d15d2587b421603222f1f975cc4bfdbc123e11f16ecbce","size_bytes":16624},"artifact_inventory":{"count":30,"sha256":"d6fb59bf8b188023d24aa6782b793403a0c6f25bf0a1d56624d8fbb7d9530b0a"},"benchmark_id":"compcoder-edger-ql-nb-fdr-tpr-v1","expanded_environment_report":{"name":"expanded-environment/compcoder-benchmark-report.json","sha256":"b908e3b6cd5fd61a220d3449de78111232cfd3570da6c00dda52f4dc2402a36f","size_bytes":16624},"implementation_changes":[{"after":{"name":"renv.lock","sha256":"f48ff0088369e717255509f66691b346d9f6ce827a77adfa1c815226c6cbcf5a","size_bytes":302438},"before":{"name":"renv.lock","sha256":"8d8ca4c7b9ab411150f207846d098cad799dcefe7219696a06e3ebf17cbe19ff","size_bytes":268638},"name":"renv.lock"},{"after":{"name":"r-sources.lock","sha256":"cbe8cdc6dae73a629dadf6a6c2e743f0fb95c20c9b85bb9acecbe23c64bd8659","size_bytes":1676},"before":{"name":"r-sources.lock","sha256":"0632d66bd4aee5cc00e7ee33f6061df0db3803843bd5bc98a91fb83c82e30f4d","size_bytes":1312},"name":"r-sources.lock"},{"after":{"name":"verify.R","sha256":"e9a1c9586e49b188311f1e8434bc412e6490c99c5b9b71be7624c1ba7722ed28","size_bytes":8540},"before":{"name":"verify.R","sha256":"0f13c98256143ae1febcb3750cd96b1c9d897d8a5cdfee1481018e12b1fc3a7e","size_bytes":8494},"name":"verify.R"}],"rebuild_metadata_changes":[],"runtime_metadata_changes":[{"after":"d56eb9cb63c0c727c0b3bd025d6c5559cf1362273a6b913bf4498a0bd5e5636c","before":"a09d33dc7b786eb86191e428b3f75406d3a25c5b8fdf8c8e4282d0e55451c331","conda_lock":{"name":"conda-lock.yml","sha256":"7cddb25b11bdd7d31a5dee156cfd2f8c456398005f3b2acc6c23d5df99e5b702","size_bytes":54784},"field":"rscript_sha256","reason":"locked_conda_prefix_relocation"}]},{"archived_report":{"name":"tests/simulation/pathway-compcoder-benchmark-report.json","sha256":"0f34458fa1fe43d31e3fcf5b6909362043229c1ea98df14e2d2015f696f6bc52","size_bytes":101207},"artifact_inventory":{"count":60,"sha256":"30fce1e8fd6c23c9f77b583756eb3468c8e7602ca48a82827aaf47c707082684"},"benchmark_id":"compcoder-limma-self-contained-fdr-tpr-v1","expanded_environment_report":{"name":"expanded-environment/pathway-compcoder-benchmark-report.json","sha256":"e6efe45e1eaee1c9788f7d5c677f29fd22b1f4a7bfedc74e5342ca7f14947732","size_bytes":101207},"implementation_changes":[{"after":{"name":"renv.lock","sha256":"f48ff0088369e717255509f66691b346d9f6ce827a77adfa1c815226c6cbcf5a","size_bytes":302438},"before":{"name":"renv.lock","sha256":"8d8ca4c7b9ab411150f207846d098cad799dcefe7219696a06e3ebf17cbe19ff","size_bytes":268638},"name":"renv.lock"},{"after":{"name":"r-sources.lock","sha256":"cbe8cdc6dae73a629dadf6a6c2e743f0fb95c20c9b85bb9acecbe23c64bd8659","size_bytes":1676},"before":{"name":"r-sources.lock","sha256":"0632d66bd4aee5cc00e7ee33f6061df0db3803843bd5bc98a91fb83c82e30f4d","size_bytes":1312},"name":"r-sources.lock"},{"after":{"name":"verify.R","sha256":"e9a1c9586e49b188311f1e8434bc412e6490c99c5b9b71be7624c1ba7722ed28","size_bytes":8540},"before":{"name":"verify.R","sha256":"0f13c98256143ae1febcb3750cd96b1c9d897d8a5cdfee1481018e12b1fc3a7e","size_bytes":8494},"name":"verify.R"}],"rebuild_metadata_changes":[{"after":{"name":"compcodeR/DESCRIPTION","sha256":"6a4792a528518c00d71f4adbbc477fcfe2fe52d76dacf555e56c2ff20ae25072","size_bytes":2523},"before":{"name":"compcodeR/DESCRIPTION","sha256":"3e68c5f0bca6b702358f17f53805809eacafb5bccadace1dfa06118befd3322b","size_bytes":2523},"input_name":"compcodeR/DESCRIPTION","reason":"installed_DESCRIPTION_build_metadata","source_archive":{"package":"compcodeR","repository":"Bioconductor 3.23","role":"primary","sha256":"9890c63d8f6cb585ef9311fa888d162ebe1148809c9082d8710f39a07a013b07","url":"https://bioconductor.org/packages/3.23/bioc/src/contrib/compcodeR_1.48.0.tar.gz","version":"1.48.0"}}],"runtime_metadata_changes":[{"after":"d56eb9cb63c0c727c0b3bd025d6c5559cf1362273a6b913bf4498a0bd5e5636c","before":"a09d33dc7b786eb86191e428b3f75406d3a25c5b8fdf8c8e4282d0e5